{
  "schema_version": "1.0",
  "id": "SRC-WLD-VALIDATION",
  "title": "Inter-coder validation results (kappa_results.json)",
  "kind": "report",
  "location": {
    "type": "repository_path",
    "ref": "validation/kappa_results.json",
    "repository": "jrklaus8/water-law-dataset",
    "commit": "cf3542e3fecdeb9570a6ecb1455e3963e12bd626"
  },
  "copyright_status": "own_work_open_licence",
  "licence": "MIT (repository licence)",
  "checksum_sha256": "407deb10aa76fc6adf994d3d62698b4a156d5215e54b4e5c21fe48a6f5b12f86",
  "size_bytes": 576,
  "format": "json",
  "extraction_status": "structured",
  "extraction_notes": "Structured. Contains only the three-label baseline specification (kappa 0.5684). The headline 0.832 reported in README.md is not stored here.",
  "identifiers": [],
  "provenance": {
    "imported_by": "Thesis2Lab initial build",
    "import_mode": "reference_only"
  }
}
