{
  "schema_version": "1.0",
  "id": "SRC-WLD-AUDIT",
  "title": "Residual audit, section 5.2: LLM-assisted reproducibility audit",
  "kind": "report",
  "location": {
    "type": "repository_path",
    "ref": "validation/RESIDUAL_AUDIT.md#52",
    "repository": "jrklaus8/water-law-dataset",
    "commit": "cf3542e3fecdeb9570a6ecb1455e3963e12bd626"
  },
  "copyright_status": "own_work_open_licence",
  "licence": "MIT (repository licence)",
  "checksum_sha256": "70a2a8ffb15b1fefa2481986fa95f52c6227eaa26fc6062689f5cf515bf27af2",
  "size_bytes": 30391,
  "format": "markdown",
  "extraction_status": "text_extracted",
  "extraction_notes": "Text read directly. Published kappa values for four specifications are taken from the table in section 5.2.",
  "identifiers": [],
  "provenance": {
    "imported_by": "Thesis2Lab initial build",
    "import_mode": "reference_only"
  }
}
