{
  "schema_version": "1.0",
  "id": "SRC-WLD-REPO",
  "title": "water-law-dataset repository (scrapers, coding engine, validation)",
  "kind": "code",
  "location": {
    "type": "url",
    "ref": "https://github.com/jrklaus8/water-law-dataset",
    "repository": "jrklaus8/water-law-dataset",
    "commit": "cf3542e3fecdeb9570a6ecb1455e3963e12bd626"
  },
  "copyright_status": "own_work_open_licence",
  "licence": "MIT",
  "checksum_sha256": null,
  "size_bytes": null,
  "format": "git repository",
  "extraction_status": "metadata_only",
  "extraction_notes": "Raw decision data (83,596 records) are excluded from the repository by .gitignore. No S-prefixed systematic review records and no legal-last-mile-systematic-review project were found in it.",
  "identifiers": [
    "doi:10.5281/zenodo.19836413"
  ],
  "provenance": {
    "imported_by": "Thesis2Lab initial build",
    "import_mode": "reference_only"
  }
}
