{
  "schema_version": "1.0",
  "id": "SRC-WLD-AANSLUIT",
  "title": "Methods note: the Dutch aansluitplicht lexical confound",
  "kind": "report",
  "location": {
    "type": "repository_path",
    "ref": "validation/METHODS_NOTE_aansluitplicht.md",
    "repository": "jrklaus8/water-law-dataset",
    "commit": "cf3542e3fecdeb9570a6ecb1455e3963e12bd626"
  },
  "copyright_status": "own_work_open_licence",
  "licence": "MIT (repository licence)",
  "checksum_sha256": "94061f57b9dfaaaaf0bafe1deae4b06269306b9bffea6bddeb049c068399d483",
  "size_bytes": 11455,
  "format": "markdown",
  "extraction_status": "text_extracted",
  "extraction_notes": "Text read directly.",
  "identifiers": [],
  "provenance": {
    "imported_by": "Thesis2Lab initial build",
    "import_mode": "reference_only"
  }
}
