{
  "schema_version": "1.0",
  "id": "SRC-WLD-CONTEXT",
  "title": "Research Context: The Legal Last Mile",
  "kind": "report",
  "location": {
    "type": "repository_path",
    "ref": "RESEARCH_CONTEXT.md",
    "repository": "jrklaus8/water-law-dataset",
    "commit": "cf3542e3fecdeb9570a6ecb1455e3963e12bd626"
  },
  "copyright_status": "own_work_open_licence",
  "licence": "MIT (repository licence)",
  "checksum_sha256": "073e17d3e0f2bcb93ba5fe784c04adc1dd1ed43ee71c0cfe3f4696a10041ae4d",
  "size_bytes": 14115,
  "format": "markdown",
  "extraction_status": "text_extracted",
  "extraction_notes": "Theory and preliminary findings as written by the researcher. Treated as research context, not validated findings.",
  "identifiers": [],
  "provenance": {
    "imported_by": "Thesis2Lab initial build",
    "import_mode": "reference_only"
  }
}
