{
  "schema_version": "1.0",
  "id": "SRC-WLD-README",
  "title": "Water Law Judicial Decisions Dataset: README",
  "kind": "report",
  "location": {
    "type": "repository_path",
    "ref": "README.md",
    "repository": "jrklaus8/water-law-dataset",
    "commit": "cf3542e3fecdeb9570a6ecb1455e3963e12bd626"
  },
  "copyright_status": "own_work_open_licence",
  "licence": "MIT (repository licence)",
  "checksum_sha256": "906cb2ee7560613e10d76901da44ec5894209a76e734e83117253cb7f67cdb41",
  "size_bytes": 14396,
  "format": "markdown",
  "extraction_status": "text_extracted",
  "extraction_notes": "Headline counts (83,596 decisions) are stated here; raw data are not in the repository.",
  "identifiers": [],
  "provenance": {
    "imported_by": "Thesis2Lab initial build",
    "import_mode": "reference_only"
  }
}
