{
  "schema_version": "1.0",
  "id": "SRC-WLD-PRELIM-PDF",
  "title": "The Legal Last Mile: preliminary research (PDF)",
  "kind": "thesis",
  "location": {
    "type": "repository_path",
    "ref": "docs/The_Legal_Last_Mile_Research.pdf",
    "repository": "jrklaus8/water-law-dataset",
    "commit": "cf3542e3fecdeb9570a6ecb1455e3963e12bd626"
  },
  "copyright_status": "unknown",
  "licence": "MIT (repository licence)",
  "checksum_sha256": "baaa1f6cf1316248d93fe8cec0276ebc1d3a44ddcf06c3a559caa390c1f2017f",
  "size_bytes": 18225058,
  "format": "pdf",
  "extraction_status": "registered",
  "extraction_notes": "Registered only. Text and page references have not been extracted. Redistribution status to be confirmed by the researcher.",
  "identifiers": [],
  "provenance": {
    "imported_by": "Thesis2Lab initial build",
    "import_mode": "reference_only"
  }
}
